<?xml version="1.0" encoding="UTF-8"?>
<xs:schema xmlns="http://www.uniovi.es" 
			elementFormDefault="qualified" 
			targetNamespace="http://www.uniovi.es" 
			xmlns:xs="http://www.w3.org/2001/XMLSchema">

	<xs:element name="circuitos">
		<xs:complexType>
			<xs:sequence>
				<xs:element minOccurs="1" maxOccurs="unbounded" ref="circuito" />
			</xs:sequence>
		</xs:complexType>
	</xs:element>

	<xs:element name="circuito">
		<xs:complexType>
			<xs:sequence>
				<xs:element ref="nombre" />
				<xs:element ref="longitudCircuito" />
				<xs:element ref="anchura" />
				<xs:element ref="fecha" />
				<xs:element ref="horaSp" />
				<xs:element ref="numeroVueltas" />
				<xs:element ref="localidad" />
				<xs:element ref="pais" />
				<xs:element ref="patrocinador" />
				<xs:element ref="bibliografia" />
				<xs:element ref="galeria" />
				<xs:element ref="videos" />
				<xs:element ref="puntoOrigen" />
				<xs:element ref="tramos" />
				<xs:element ref="vencedor" />
				<xs:element ref="clasificacionMundial" />
			</xs:sequence>
		</xs:complexType>
	</xs:element>

	<xs:element name="nombre" type="xs:string" />
	<xs:element name="fecha" type="xs:date" />
	<xs:element name="horaSp" type="xs:time" />

	<xs:element name="numeroVueltas"> 
		<xs:simpleType>
			<xs:restriction base="xs:integer">
				<xs:minInclusive value="1"/>
			</xs:restriction>
		</xs:simpleType>
	</xs:element>

	<xs:element name="localidad" type="xs:string" />
	<xs:element name="pais" type="xs:string" />
	<xs:element name="patrocinador" type="xs:string" />

	<xs:element name="longitudCircuito">
		<xs:complexType>
			<xs:simpleContent>
				<xs:extension base="xs:float">
					<xs:attribute name="unidades" type="xs:string" use="required" />
				</xs:extension>
			</xs:simpleContent>
		</xs:complexType>
	</xs:element>

	<xs:element name="anchura">
		<xs:complexType>
			<xs:simpleContent>
				<xs:extension base="xs:float">
					<xs:attribute name="unidades" type="xs:string" use="required" />
				</xs:extension>
			</xs:simpleContent>
		</xs:complexType>
	</xs:element>

	<xs:element name="bibliografia">
		<xs:complexType>
			<xs:sequence>
				<xs:element minOccurs="3" maxOccurs="unbounded" ref="referencia" />
			</xs:sequence>
		</xs:complexType>
	</xs:element>

	<xs:element name="referencia">
		<xs:complexType>
			<xs:simpleContent>
				<xs:extension base="xs:string">
					<xs:attribute name="descripcion" type="xs:string" use="required" />
				</xs:extension>
			</xs:simpleContent>
		</xs:complexType>
	</xs:element>

	<xs:element name="galeria">
		<xs:complexType>
			<xs:sequence>
				<xs:element minOccurs="1" maxOccurs="5" ref="foto" />
			</xs:sequence>
		</xs:complexType>
	</xs:element>

	<xs:element name="foto">
		<xs:complexType>
			<xs:simpleContent>
				<xs:extension base="xs:string">
					<xs:attribute name="descripcion" type="xs:string" use="required" />
				</xs:extension>
			</xs:simpleContent>
		</xs:complexType>
	</xs:element>

	<xs:element name="videos">
		<xs:complexType>
			<xs:sequence>
				<xs:element minOccurs="1" maxOccurs="3" ref="video" />
			</xs:sequence>
		</xs:complexType>
	</xs:element>

	<xs:element name="video">
		<xs:complexType>
			<xs:simpleContent>
				<xs:extension base="xs:string">
					<xs:attribute name="descripcion" type="xs:string" use="required" />
				</xs:extension>
			</xs:simpleContent>
		</xs:complexType>
	</xs:element>

	<xs:element name="puntoOrigen">
		<xs:complexType>
			<xs:sequence>
				<xs:element ref="longitud" />
				<xs:element ref="latitud" />
				<xs:element ref="altitud" />
			</xs:sequence>
		</xs:complexType>
	</xs:element>

	<xs:element name="longitud">
		<xs:complexType>
			<xs:simpleContent>
				<xs:extension base="xs:float">
					<xs:attribute name="unidades" type="xs:string" use="required" />
				</xs:extension>
			</xs:simpleContent>
		</xs:complexType>
	</xs:element>

	<xs:element name="latitud">
		<xs:complexType>
			<xs:simpleContent>
				<xs:extension base="xs:float">
					<xs:attribute name="unidades" type="xs:string" use="required" />
				</xs:extension>
			</xs:simpleContent>
		</xs:complexType>
	</xs:element>

	<xs:element name="altitud">
		<xs:complexType>
			<xs:simpleContent>
				<xs:extension base="xs:float">
					<xs:attribute name="unidades" type="xs:string" use="required" />
				</xs:extension>
			</xs:simpleContent>
		</xs:complexType>
	</xs:element>

	<xs:element name="tramos">
		<xs:complexType>
			<xs:sequence>
				<xs:element minOccurs="1" maxOccurs="unbounded" ref="tramo" />
			</xs:sequence>
		</xs:complexType>
	</xs:element>

	<xs:element name="tramo">
		<xs:complexType>
			<xs:sequence>
				<xs:element ref="distancia" />
				<xs:element ref="coordenadas" />
				<xs:element ref="sector" />
			</xs:sequence>
		</xs:complexType>
	</xs:element>

	<xs:element name="distancia">
		<xs:complexType>
			<xs:simpleContent>
				<xs:extension base="xs:float">
					<xs:attribute name="unidades" type="xs:string" use="required" />
				</xs:extension>
			</xs:simpleContent>
		</xs:complexType>
	</xs:element>

	<xs:element name="coordenadas">
		<xs:complexType>
			<xs:sequence>
				<xs:element ref="longitud" />
				<xs:element ref="latitud" />
				<xs:element ref="altitud" />
			</xs:sequence>
		</xs:complexType>
	</xs:element>

	<xs:element name="sector">
		<xs:simpleType>
			<xs:restriction base="xs:integer">
				<xs:minInclusive value="1"/>
				<xs:maxInclusive value="3"/>
			</xs:restriction>
		</xs:simpleType>
	</xs:element>

	<xs:element name="vencedor">
		<xs:complexType>
			<xs:sequence>
				<xs:element ref="nombre" />
				<xs:element ref="duracion" />
			</xs:sequence>
		</xs:complexType>
	</xs:element>

	<xs:element name="duracion" type="xs:duration" />

	<xs:element name="clasificacionMundial">
		<xs:complexType>
			<xs:sequence>
				<xs:element minOccurs="1" maxOccurs="unbounded" ref="posicion" />
			</xs:sequence>
		</xs:complexType>
	</xs:element>

	<xs:element name="posicion">
		<xs:complexType>
			<xs:sequence>
				<xs:element ref="nombre" />
				<xs:element ref="puntos" />
				<xs:element ref="pais" />
			</xs:sequence>
			<xs:attribute name="numero" type="xs:positiveInteger" use="required" />
		</xs:complexType>
	</xs:element>
	
	<xs:element name="puntos"> 
		<xs:simpleType>
			<xs:restriction base="xs:integer">
				<xs:minInclusive value="0"/>
			</xs:restriction>
		</xs:simpleType>
	</xs:element>
</xs:schema>